1335107159.331113 IP localhost.41949 > localhost.8118: Flags [S], seq 53112622, win 32792, options [mss 16396,sackOK,TS val 47245802 ecr 0], length 0
1335107159.331180 IP localhost.8118 > localhost.41949: Flags [S.], seq 53265041, ack 53112623, win 32768, options [mss 16396,sackOK,TS val 47245802 ecr 47245802], length 0
1335107159.331230 IP localhost.41949 > localhost.8118: Flags [.], ack 1, win 32792, options [nop,nop,TS val 47245802 ecr 47245802], length 0
1335107159.351626 IP localhost.41949 > localhost.8118: Flags [P.], seq 1:389, ack 1, win 32792, options [nop,nop,TS val 47245807 ecr 47245802], length 388
1335107159.351707 IP localhost.8118 > localhost.41949: Flags [.], ack 389, win 33768, options [nop,nop,TS val 47245807 ecr 47245807], length 0
1335107159.352572 IP bilbo-netbook.44149 > router.domain: 24532+ A? www.wikipedia.org. (35)
1335107159.354076 IP bilbo-netbook.33490 > router.domain: 31595+ PTR? 102.1.168.192.in-addr.arpa. (44)
1335107159.354928 IP router.domain > bilbo-netbook.33490: 31595* 1/0/0 PTR bilbo-netbook. (71)
1335107159.411324 IP router.domain > bilbo-netbook.44149: 24532 3/0/0 CNAME wikipedia-lb.wikimedia.org., CNAME wikipedia-lb.esams.wikimedia.org., A 91.198.174.225 (121)
1335107159.411853 IP bilbo-netbook.44616 > wikipedia-lb.esams.wikimedia.org.www: Flags [S], seq 63912268, win 5840, options [mss 1460,sackOK,TS val 47245822 ecr 0], length 0
1335107159.412269 IP bilbo-netbook.49852 > router.domain: 17083+ PTR? 225.174.198.91.in-addr.arpa. (45)
1335107159.443375 IP router.domain > bilbo-netbook.49852: 17083 1/0/0 PTR wikipedia-lb.esams.wikimedia.org. (91)
1335107159.458536 IP wikipedia-lb.esams.wikimedia.org.www > bilbo-netbook.44616: Flags [S.], seq 1243724367, ack 63912269, win 5792, options [mss 1412,sackOK,TS val 1132654426 ecr 47245822], length 0
1335107159.458716 IP bilbo-netbook.44616 > wikipedia-lb.esams.wikimedia.org.www: Flags [.], ack 1, win 5840, options [nop,nop,TS val 47245834 ecr 1132654426], length 0
1335107159.458920 IP bilbo-netbook.44616 > wikipedia-lb.esams.wikimedia.org.www: Flags [P.], seq 1:371, ack 1, win 5840, options [nop,nop,TS val 47245834 ecr 1132654426], length 370
1335107159.525405 IP wikipedia-lb.esams.wikimedia.org.www > bilbo-netbook.44616: Flags [.], ack 371, win 6432, options [nop,nop,TS val 1132654433 ecr 47245834], length 0
1335107159.526480 IP wikipedia-lb.esams.wikimedia.org.www > bilbo-netbook.44616: Flags [P.], seq 1:558, ack 371, win 6432, options [nop,nop,TS val 1132654433 ecr 47245834], length 557
1335107159.526607 IP bilbo-netbook.44616 > wikipedia-lb.esams.wikimedia.org.www: Flags [.], ack 558, win 6684, options [nop,nop,TS val 47245851 ecr 1132654433], length 0
1335107159.533015 IP wikipedia-lb.esams.wikimedia.org.www > bilbo-netbook.44616: Flags [.], seq 558:1958, ack 371, win 6432, options [nop,nop,TS val 1132654433 ecr 47245834], length 1400
1335107159.533158 IP bilbo-netbook.44616 > wikipedia-lb.esams.wikimedia.org.www: Flags [.], ack 1958, win 9800, options [nop,nop,TS val 47245852 ecr 1132654433], length 0
1335107159.540284 IP wikipedia-lb.esams.wikimedia.org.www > bilbo-netbook.44616: Flags [.], seq 1958:3358, ack 371, win 6432, options [nop,nop,TS val 1132654433 ecr 47245834], length 1400
1335107159.540421 IP bilbo-netbook.44616 > wikipedia-lb.esams.wikimedia.org.www: Flags [.], ack 3358, win 12600, options [nop,nop,TS val 47245854 ecr 1132654433], length 0
1335107159.566028 IP wikipedia-lb.esams.wikimedia.org.www > bilbo-netbook.44616: Flags [P.], seq 3358:4654, ack 371, win 6432, options [nop,nop,TS val 1132654433 ecr 47245834], length 1296
1335107159.566168 IP bilbo-netbook.44616 > wikipedia-lb.esams.wikimedia.org.www: Flags [.], ack 4654, win 15400, options [nop,nop,TS val 47245861 ecr 1132654433], length 0
1335107159.591644 IP wikipedia-lb.esams.wikimedia.org.www > bilbo-netbook.44616: Flags [.], seq 4654:6054, ack 371, win 6432, options [nop,nop,TS val 1132654438 ecr 47245851], length 1400
1335107159.591781 IP bilbo-netbook.44616 > wikipedia-lb.esams.wikimedia.org.www: Flags [.], ack 6054, win 18200, options [nop,nop,TS val 47245867 ecr 1132654438], length 0
1335107159.595052 IP wikipedia-lb.esams.wikimedia.org.www > bilbo-netbook.44616: Flags [.], seq 6054:7454, ack 371, win 6432, options [nop,nop,TS val 1132654438 ecr 47245852], length 1400
1335107159.595176 IP bilbo-netbook.44616 > wikipedia-lb.esams.wikimedia.org.www: Flags [.], ack 7454, win 21000, options [nop,nop,TS val 47245868 ecr 1132654438], length 0
1335107159.610065 IP wikipedia-lb.esams.wikimedia.org.www > bilbo-netbook.44616: Flags [.], seq 7454:8854, ack 371, win 6432, options [nop,nop,TS val 1132654438 ecr 47245852], length 1400
1335107159.610206 IP bilbo-netbook.44616 > wikipedia-lb.esams.wikimedia.org.www: Flags [.], ack 8854, win 23800, options [nop,nop,TS val 47245872 ecr 1132654438], length 0
1335107159.642553 IP wikipedia-lb.esams.wikimedia.org.www > bilbo-netbook.44616: Flags [.], seq 8854:10254, ack 371, win 6432, options [nop,nop,TS val 1132654438 ecr 47245852], length 1400
1335107159.642700 IP bilbo-netbook.44616 > wikipedia-lb.esams.wikimedia.org.www: Flags [.], ack 10254, win 26600, options [nop,nop,TS val 47245880 ecr 1132654438], length 0
1335107159.656417 IP wikipedia-lb.esams.wikimedia.org.www > bilbo-netbook.44616: Flags [.], seq 10254:11654, ack 371, win 6432, options [nop,nop,TS val 1132654439 ecr 47245854], length 1400
1335107159.656550 IP bilbo-netbook.44616 > wikipedia-lb.esams.wikimedia.org.www: Flags [.], ack 11654, win 29400, options [nop,nop,TS val 47245883 ecr 1132654439], length 0
1335107159.663443 IP wikipedia-lb.esams.wikimedia.org.www > bilbo-netbook.44616: Flags [.], seq 11654:13054, ack 371, win 6432, options [nop,nop,TS val 1132654439 ecr 47245854], length 1400
1335107159.663588 IP bilbo-netbook.44616 > wikipedia-lb.esams.wikimedia.org.www: Flags [.], ack 13054, win 32200, options [nop,nop,TS val 47245885 ecr 1132654439], length 0
1335107159.680247 IP wikipedia-lb.esams.wikimedia.org.www > bilbo-netbook.44616: Flags [FP.], seq 13054:13210, ack 371, win 6432, options [nop,nop,TS val 1132654439 ecr 47245854], length 156
1335107159.687367 IP localhost.8118 > localhost.41949: Flags [P.], seq 1:534, ack 389, win 33768, options [nop,nop,TS val 47245891 ecr 47245807], length 533
1335107159.687447 IP localhost.41949 > localhost.8118: Flags [.], ack 534, win 33768, options [nop,nop,TS val 47245891 ecr 47245891], length 0
1335107159.687532 IP localhost.8118 > localhost.41949: Flags [.], seq 534:16918, ack 389, win 33768, options [nop,nop,TS val 47245891 ecr 47245891], length 16384
1335107159.687568 IP localhost.41949 > localhost.8118: Flags [.], ack 16918, win 49152, options [nop,nop,TS val 47245891 ecr 47245891], length 0
1335107159.687628 IP localhost.8118 > localhost.41949: Flags [P.], seq 16918:33302, ack 389, win 33768, options [nop,nop,TS val 47245891 ecr 47245891], length 16384
1335107159.687662 IP localhost.41949 > localhost.8118: Flags [.], ack 33302, win 49152, options [nop,nop,TS val 47245891 ecr 47245891], length 0
1335107159.687728 IP localhost.8118 > localhost.41949: Flags [P.], seq 33302:48839, ack 389, win 33768, options [nop,nop,TS val 47245891 ecr 47245891], length 15537
1335107159.687768 IP localhost.41949 > localhost.8118: Flags [.], ack 48839, win 49152, options [nop,nop,TS val 47245891 ecr 47245891], length 0
1335107159.687831 IP bilbo-netbook.44616 > wikipedia-lb.esams.wikimedia.org.www: Flags [F.], seq 371, ack 13211, win 32200, options [nop,nop,TS val 47245891 ecr 1132654439], length 0
1335107159.688004 IP localhost.8118 > localhost.41949: Flags [F.], seq 48839, ack 389, win 33768, options [nop,nop,TS val 47245891 ecr 47245891], length 0
1335107159.694763 IP localhost.41949 > localhost.8118: Flags [F.], seq 389, ack 48840, win 49152, options [nop,nop,TS val 47245893 ecr 47245891], length 0
1335107159.694827 IP localhost.8118 > localhost.41949: Flags [.], ack 390, win 33768, options [nop,nop,TS val 47245893 ecr 47245893], length 0
1335107159.735212 IP wikipedia-lb.esams.wikimedia.org.www > bilbo-netbook.44616: Flags [.], ack 372, win 6432, options [nop,nop,TS val 1132654454 ecr 47245891], length 0
1335107159.735725 IP localhost.41951 > localhost.8118: Flags [S], seq 69122802, win 32792, options [mss 16396,sackOK,TS val 47245903 ecr 0], length 0
1335107159.735768 IP localhost.8118 > localhost.41951: Flags [S.], seq 62187863, ack 69122803, win 32768, options [mss 16396,sackOK,TS val 47245903 ecr 47245903], length 0
1335107159.735803 IP localhost.41951 > localhost.8118: Flags [.], ack 1, win 32792, options [nop,nop,TS val 47245903 ecr 47245903], length 0
1335107159.738679 IP localhost.41951 > localhost.8118: Flags [P.], seq 1:520, ack 1, win 32792, options [nop,nop,TS val 47245904 ecr 47245903], length 519
1335107159.738736 IP localhost.8118 > localhost.41951: Flags [.], ack 520, win 33768, options [nop,nop,TS val 47245904 ecr 47245904], length 0
1335107159.739680 IP bilbo-netbook.52735 > router.domain: 47474+ A? en.wikipedia.org. (34)
1335107159.739979 IP localhost.41952 > localhost.8118: Flags [S], seq 67563164, win 32792, options [mss 16396,sackOK,TS val 47245904 ecr 0], length 0
1335107159.740019 IP localhost.8118 > localhost.41952: Flags [S.], seq 66397163, ack 67563165, win 32768, options [mss 16396,sackOK,TS val 47245904 ecr 47245904], length 0
1335107159.740053 IP localhost.41952 > localhost.8118: Flags [.], ack 1, win 32792, options [nop,nop,TS val 47245904 ecr 47245904], length 0
1335107159.743613 IP localhost.41952 > localhost.8118: Flags [P.], seq 1:465, ack 1, win 32792, options [nop,nop,TS val 47245905 ecr 47245904], length 464
1335107159.743672 IP localhost.8118 > localhost.41952: Flags [.], ack 465, win 33768, options [nop,nop,TS val 47245905 ecr 47245905], length 0
1335107159.744434 IP bilbo-netbook.37191 > router.domain: 34357+ A? bits.wikimedia.org. (36)
1335107159.774348 IP router.domain > bilbo-netbook.52735: 47474 3/0/0 CNAME wikipedia-lb.wikimedia.org., CNAME wikipedia-lb.esams.wikimedia.org., A 91.198.174.225 (120)
1335107159.774668 IP bilbo-netbook.44619 > wikipedia-lb.esams.wikimedia.org.www: Flags [S], seq 60912950, win 5840, options [mss 1460,sackOK,TS val 47245913 ecr 0], length 0
1335107159.782735 IP router.domain > bilbo-netbook.37191: 34357 3/0/0 CNAME bits-geo.wikimedia.org., CNAME bits.esams.wikimedia.org., A 91.198.174.233 (100)
1335107159.783037 IP bilbo-netbook.52035 > bits.esams.wikimedia.org.www: Flags [S], seq 64339922, win 5840, options [mss 1460,sackOK,TS val 47245915 ecr 0], length 0
1335107159.783354 IP bilbo-netbook.33971 > router.domain: 8980+ PTR? 233.174.198.91.in-addr.arpa. (45)
1335107159.812519 IP localhost.41955 > localhost.8118: Flags [S], seq 69769290, win 32792, options [mss 16396,sackOK,TS val 47245922 ecr 0], length 0
1335107159.812553 IP localhost.8118 > localhost.41955: Flags [S.], seq 58977332, ack 69769291, win 32768, options [mss 16396,sackOK,TS val 47245922 ecr 47245922], length 0
1335107159.812579 IP localhost.41955 > localhost.8118: Flags [.], ack 1, win 32792, options [nop,nop,TS val 47245922 ecr 47245922], length 0
1335107159.813138 IP localhost.41956 > localhost.8118: Flags [S], seq 73847120, win 32792, options [mss 16396,sackOK,TS val 47245922 ecr 0], length 0
1335107159.813166 IP localhost.8118 > localhost.41956: Flags [S.], seq 70143514, ack 73847121, win 32768, options [mss 16396,sackOK,TS val 47245922 ecr 47245922], length 0
1335107159.813190 IP localhost.41956 > localhost.8118: Flags [.], ack 1, win 32792, options [nop,nop,TS val 47245922 ecr 47245922], length 0
1335107159.815879 IP localhost.41955 > localhost.8118: Flags [P.], seq 1:565, ack 1, win 32792, options [nop,nop,TS val 47245923 ecr 47245922], length 564
1335107159.815929 IP localhost.8118 > localhost.41955: Flags [.], ack 565, win 33840, options [nop,nop,TS val 47245923 ecr 47245923], length 0
1335107159.815984 IP localhost.41956 > localhost.8118: Flags [P.], seq 1:472, ack 1, win 32792, options [nop,nop,TS val 47245923 ecr 47245922], length 471
1335107159.816020 IP localhost.8118 > localhost.41956: Flags [.], ack 472, win 33768, options [nop,nop,TS val 47245923 ecr 47245923], length 0
1335107159.817133 IP bilbo-netbook.48039 > router.domain: 21688+ A? upload.wikimedia.org. (38)
1335107159.817324 IP bilbo-netbook.37312 > router.domain: 57246+ A? upload.wikimedia.org. (38)
1335107159.821466 IP wikipedia-lb.esams.wikimedia.org.www > bilbo-netbook.44619: Flags [S.], seq 3938980831, ack 60912951, win 5792, options [mss 1412,sackOK,TS val 1414801891 ecr 47245913], length 0
1335107159.821617 IP bilbo-netbook.44619 > wikipedia-lb.esams.wikimedia.org.www: Flags [.], ack 1, win 5840, options [nop,nop,TS val 47245924 ecr 1414801891], length 0
1335107159.821750 IP router.domain > bilbo-netbook.33971: 8980 1/0/0 PTR bits.esams.wikimedia.org. (83)
1335107159.821904 IP bilbo-netbook.44619 > wikipedia-lb.esams.wikimedia.org.www: Flags [P.], seq 1:467, ack 1, win 5840, options [nop,nop,TS val 47245925 ecr 1414801891], length 466
1335107159.840198 IP bits.esams.wikimedia.org.www > bilbo-netbook.52035: Flags [S.], seq 573961061, ack 64339923, win 5792, options [mss 1412,sackOK,TS val 207801280 ecr 47245915], length 0
1335107159.840372 IP bilbo-netbook.52035 > bits.esams.wikimedia.org.www: Flags [.], ack 1, win 5840, options [nop,nop,TS val 47245929 ecr 207801280], length 0
1335107159.840572 IP bilbo-netbook.52035 > bits.esams.wikimedia.org.www: Flags [P.], seq 1:410, ack 1, win 5840, options [nop,nop,TS val 47245929 ecr 207801280], length 409
1335107159.901339 IP router.domain > bilbo-netbook.48039: 21688 2/0/0 CNAME upload.esams.wikimedia.org., A 91.198.174.234 (81)
1335107159.901829 IP bilbo-netbook.44723 > upload.esams.wikimedia.org.www: Flags [S], seq 75622636, win 5840, options [mss 1460,sackOK,TS val 47245944 ecr 0], length 0
1335107159.902236 IP bilbo-netbook.50003 > router.domain: 33071+ PTR? 234.174.198.91.in-addr.arpa. (45)
1335107159.909605 IP router.domain > bilbo-netbook.37312: 57246 2/0/0 CNAME upload.esams.wikimedia.org., A 91.198.174.234 (81)
1335107159.909934 IP bilbo-netbook.44724 > upload.esams.wikimedia.org.www: Flags [S], seq 75556900, win 5840, options [mss 1460,sackOK,TS val 47245947 ecr 0], length 0
1335107159.918828 IP wikipedia-lb.esams.wikimedia.org.www > bilbo-netbook.44619: Flags [.], ack 467, win 6432, options [nop,nop,TS val 1414801901 ecr 47245925], length 0
1335107159.921102 IP wikipedia-lb.esams.wikimedia.org.www > bilbo-netbook.44619: Flags [P.], seq 1:299, ack 467, win 6432, options [nop,nop,TS val 1414801901 ecr 47245925], length 298
1335107159.921221 IP bilbo-netbook.44619 > wikipedia-lb.esams.wikimedia.org.www: Flags [.], ack 299, win 6432, options [nop,nop,TS val 47245949 ecr 1414801901], length 0
1335107159.921543 IP localhost.8118 > localhost.41951: Flags [P.], seq 1:299, ack 520, win 33768, options [nop,nop,TS val 47245949 ecr 47245904], length 298
1335107159.921567 IP localhost.41951 > localhost.8118: Flags [.], ack 299, win 32792, options [nop,nop,TS val 47245949 ecr 47245949], length 0
1335107159.921618 IP bilbo-netbook.44619 > wikipedia-lb.esams.wikimedia.org.www: Flags [F.], seq 467, ack 299, win 6432, options [nop,nop,TS val 47245949 ecr 1414801901], length 0
1335107159.921728 IP wikipedia-lb.esams.wikimedia.org.www > bilbo-netbook.44619: Flags [F.], seq 299, ack 467, win 6432, options [nop,nop,TS val 1414801901 ecr 47245925], length 0
1335107159.921806 IP localhost.8118 > localhost.41951: Flags [F.], seq 299, ack 520, win 33768, options [nop,nop,TS val 47245949 ecr 47245949], length 0
1335107159.921846 IP bilbo-netbook.44619 > wikipedia-lb.esams.wikimedia.org.www: Flags [.], ack 300, win 6432, options [nop,nop,TS val 47245949 ecr 1414801901], length 0
1335107159.933857 IP bits.esams.wikimedia.org.www > bilbo-netbook.52035: Flags [.], ack 410, win 6432, options [nop,nop,TS val 207801291 ecr 47245929], length 0
1335107159.942886 IP localhost.41951 > localhost.8118: Flags [F.], seq 520, ack 300, win 32792, options [nop,nop,TS val 47245955 ecr 47245949], length 0
1335107159.942978 IP bits.esams.wikimedia.org.www > bilbo-netbook.52035: Flags [.], seq 1:1401, ack 410, win 6432, options [nop,nop,TS val 207801291 ecr 47245929], length 1400
1335107159.942979 IP localhost.8118 > localhost.41951: Flags [.], ack 521, win 33768, options [nop,nop,TS val 47245955 ecr 47245955], length 0
1335107159.943080 IP bilbo-netbook.52035 > bits.esams.wikimedia.org.www: Flags [.], ack 1401, win 8400, options [nop,nop,TS val 47245955 ecr 207801291], length 0
1335107159.943373 IP localhost.41959 > localhost.8118: Flags [S], seq 68992727, win 32792, options [mss 16396,sackOK,TS val 47245955 ecr 0], length 0
1335107159.943402 IP localhost.8118 > localhost.41959: Flags [S.], seq 62072900, ack 68992728, win 32768, options [mss 16396,sackOK,TS val 47245955 ecr 47245955], length 0
1335107159.943431 IP localhost.41959 > localhost.8118: Flags [.], ack 1, win 32792, options [nop,nop,TS val 47245955 ecr 47245955], length 0
1335107159.944868 IP localhost.41959 > localhost.8118: Flags [P.], seq 1:476, ack 1, win 32792, options [nop,nop,TS val 47245955 ecr 47245955], length 475
1335107159.944925 IP localhost.8118 > localhost.41959: Flags [.], ack 476, win 33768, options [nop,nop,TS val 47245955 ecr 47245955], length 0
1335107159.945761 IP bits.esams.wikimedia.org.www > bilbo-netbook.52035: Flags [.], seq 1401:2801, ack 410, win 6432, options [nop,nop,TS val 207801291 ecr 47245929], length 1400
1335107159.945870 IP bilbo-netbook.52035 > bits.esams.wikimedia.org.www: Flags [.], ack 2801, win 11200, options [nop,nop,TS val 47245955 ecr 207801291], length 0
1335107159.946113 IP bilbo-netbook.59897 > router.domain: 50147+ A? upload.wikimedia.org. (38)
1335107159.946872 IP router.domain > bilbo-netbook.59897: 50147 2/0/0 CNAME upload.esams.wikimedia.org., A 91.198.174.234 (94)
1335107159.947133 IP bilbo-netbook.44726 > upload.esams.wikimedia.org.www: Flags [S], seq 63921339, win 5840, options [mss 1460,sackOK,TS val 47245956 ecr 0], length 0
1335107160.012446 IP bits.esams.wikimedia.org.www > bilbo-netbook.52035: Flags [.], seq 2801:4201, ack 410, win 6432, options [nop,nop,TS val 207801291 ecr 47245929], length 1400
1335107160.012567 IP bilbo-netbook.52035 > bits.esams.wikimedia.org.www: Flags [.], ack 4201, win 14000, options [nop,nop,TS val 47245972 ecr 207801291], length 0
1335107160.014537 IP bits.esams.wikimedia.org.www > bilbo-netbook.52035: Flags [P.], seq 4201:5236, ack 410, win 6432, options [nop,nop,TS val 207801291 ecr 47245929], length 1035
1335107160.014649 IP bilbo-netbook.52035 > bits.esams.wikimedia.org.www: Flags [.], ack 5236, win 16800, options [nop,nop,TS val 47245973 ecr 207801291], length 0
1335107160.015804 IP localhost.8118 > localhost.41952: Flags [P.], seq 1:505, ack 465, win 33768, options [nop,nop,TS val 47245973 ecr 47245905], length 504
1335107160.015842 IP localhost.41952 > localhost.8118: Flags [.], ack 505, win 33768, options [nop,nop,TS val 47245973 ecr 47245973], length 0
1335107160.015910 IP localhost.8118 > localhost.41952: Flags [P.], seq 505:16778, ack 465, win 33768, options [nop,nop,TS val 47245973 ecr 47245973], length 16273
1335107160.015932 IP localhost.41952 > localhost.8118: Flags [.], ack 16778, win 65092, options [nop,nop,TS val 47245973 ecr 47245973], length 0
1335107160.015977 IP bilbo-netbook.52035 > bits.esams.wikimedia.org.www: Flags [F.], seq 410, ack 5236, win 16800, options [nop,nop,TS val 47245973 ecr 207801291], length 0
1335107160.016117 IP localhost.8118 > localhost.41952: Flags [F.], seq 16778, ack 465, win 33768, options [nop,nop,TS val 47245973 ecr 47245973], length 0
1335107160.017525 IP bits.esams.wikimedia.org.www > bilbo-netbook.52035: Flags [F.], seq 5236, ack 410, win 6432, options [nop,nop,TS val 207801291 ecr 47245929], length 0
1335107160.017636 IP bilbo-netbook.52035 > bits.esams.wikimedia.org.www: Flags [.], ack 5237, win 16800, options [nop,nop,TS val 47245973 ecr 207801291], length 0
1335107160.019219 IP router.domain > bilbo-netbook.50003: 33071 1/0/0 PTR upload.esams.wikimedia.org. (85)
1335107160.019616 IP upload.esams.wikimedia.org.www > bilbo-netbook.44723: Flags [S.], seq 92013917, ack 75622637, win 5792, options [mss 1412,sackOK,TS val 1631716055 ecr 47245944], length 0
1335107160.019779 IP bilbo-netbook.44723 > upload.esams.wikimedia.org.www: Flags [.], ack 1, win 5840, options [nop,nop,TS val 47245974 ecr 1631716055], length 0
1335107160.021758 IP upload.esams.wikimedia.org.www > bilbo-netbook.44724: Flags [S.], seq 3811856649, ack 75556901, win 5792, options [mss 1412,sackOK,TS val 1408438150 ecr 47245947], length 0
1335107160.021871 IP bilbo-netbook.44724 > upload.esams.wikimedia.org.www: Flags [.], ack 1, win 5840, options [nop,nop,TS val 47245974 ecr 1408438150], length 0
1335107160.022052 IP bilbo-netbook.44724 > upload.esams.wikimedia.org.www: Flags [P.], seq 1:508, ack 1, win 5840, options [nop,nop,TS val 47245975 ecr 1408438150], length 507
1335107160.022237 IP bilbo-netbook.44723 > upload.esams.wikimedia.org.www: Flags [P.], seq 1:415, ack 1, win 5840, options [nop,nop,TS val 47245975 ecr 1631716055], length 414
1335107160.022753 IP wikipedia-lb.esams.wikimedia.org.www > bilbo-netbook.44619: Flags [.], ack 468, win 6432, options [nop,nop,TS val 1414801906 ecr 47245949], length 0
1335107160.053964 IP localhost.41952 > localhost.8118: Flags [.], ack 16779, win 65092, options [nop,nop,TS val 47245983 ecr 47245973], length 0
1335107160.054337 IP localhost.41952 > localhost.8118: Flags [F.], seq 465, ack 16779, win 65092, options [nop,nop,TS val 47245983 ecr 47245973], length 0
1335107160.054390 IP localhost.8118 > localhost.41952: Flags [.], ack 466, win 33768, options [nop,nop,TS val 47245983 ecr 47245983], length 0
1335107160.054655 IP localhost.41961 > localhost.8118: Flags [S], seq 75108085, win 32792, options [mss 16396,sackOK,TS val 47245983 ecr 0], length 0
1335107160.054711 IP localhost.8118 > localhost.41961: Flags [S.], seq 70641046, ack 75108086, win 32768, options [mss 16396,sackOK,TS val 47245983 ecr 47245983], length 0
1335107160.054745 IP localhost.41961 > localhost.8118: Flags [.], ack 1, win 32792, options [nop,nop,TS val 47245983 ecr 47245983], length 0
1335107160.063262 IP localhost.41961 > localhost.8118: Flags [P.], seq 1:562, ack 1, win 32792, options [nop,nop,TS val 47245985 ecr 47245983], length 561
1335107160.063328 IP localhost.8118 > localhost.41961: Flags [.], ack 562, win 33660, options [nop,nop,TS val 47245985 ecr 47245985], length 0
1335107160.064692 IP bilbo-netbook.48824 > router.domain: 3768+ A? upload.wikimedia.org. (38)
1335107160.065534 IP router.domain > bilbo-netbook.48824: 3768 2/0/0 CNAME upload.esams.wikimedia.org., A 91.198.174.234 (94)
1335107160.065950 IP bilbo-netbook.44728 > upload.esams.wikimedia.org.www: Flags [S], seq 64575965, win 5840, options [mss 1460,sackOK,TS val 47245986 ecr 0], length 0
1335107160.080745 IP upload.esams.wikimedia.org.www > bilbo-netbook.44726: Flags [S.], seq 572325546, ack 63921340, win 5792, options [mss 1412,sackOK,TS val 1416428148 ecr 47245956], length 0
1335107160.080896 IP bilbo-netbook.44726 > upload.esams.wikimedia.org.www: Flags [.], ack 1, win 5840, options [nop,nop,TS val 47245989 ecr 1416428148], length 0
1335107160.081030 IP bilbo-netbook.44726 > upload.esams.wikimedia.org.www: Flags [P.], seq 1:419, ack 1, win 5840, options [nop,nop,TS val 47245989 ecr 1416428148], length 418
1335107160.091899 IP bits.esams.wikimedia.org.www > bilbo-netbook.52035: Flags [.], ack 411, win 6432, options [nop,nop,TS val 207801306 ecr 47245973], length 0
1335107160.130222 IP upload.esams.wikimedia.org.www > bilbo-netbook.44724: Flags [.], ack 508, win 6432, options [nop,nop,TS val 1408438164 ecr 47245975], length 0
1335107160.132219 IP upload.esams.wikimedia.org.www > bilbo-netbook.44723: Flags [.], ack 415, win 6432, options [nop,nop,TS val 1631716072 ecr 47245975], length 0
1335107160.135047 IP upload.esams.wikimedia.org.www > bilbo-netbook.44723: Flags [P.], seq 1:476, ack 415, win 6432, options [nop,nop,TS val 1631716072 ecr 47245975], length 475
1335107160.135175 IP bilbo-netbook.44723 > upload.esams.wikimedia.org.www: Flags [.], ack 476, win 6432, options [nop,nop,TS val 47246003 ecr 1631716072], length 0
1335107160.135620 IP localhost.8118 > localhost.41956: Flags [P.], seq 1:476, ack 472, win 33768, options [nop,nop,TS val 47246003 ecr 47245923], length 475
1335107160.135654 IP localhost.41956 > localhost.8118: Flags [.], ack 476, win 33768, options [nop,nop,TS val 47246003 ecr 47246003], length 0
1335107160.137024 IP upload.esams.wikimedia.org.www > bilbo-netbook.44724: Flags [P.], seq 1:274, ack 508, win 6432, options [nop,nop,TS val 1408438166 ecr 47245975], length 273
1335107160.137138 IP bilbo-netbook.44724 > upload.esams.wikimedia.org.www: Flags [.], ack 274, win 6432, options [nop,nop,TS val 47246003 ecr 1408438166], length 0
1335107160.137493 IP localhost.8118 > localhost.41955: Flags [P.], seq 1:274, ack 565, win 33840, options [nop,nop,TS val 47246003 ecr 47245923], length 273
1335107160.137526 IP localhost.41955 > localhost.8118: Flags [.], ack 274, win 32792, options [nop,nop,TS val 47246003 ecr 47246003], length 0
1335107160.137579 IP bilbo-netbook.44724 > upload.esams.wikimedia.org.www: Flags [F.], seq 508, ack 274, win 6432, options [nop,nop,TS val 47246003 ecr 1408438166], length 0
1335107160.137660 IP localhost.8118 > localhost.41955: Flags [F.], seq 274, ack 565, win 33840, options [nop,nop,TS val 47246003 ecr 47246003], length 0
1335107160.143716 IP upload.esams.wikimedia.org.www > bilbo-netbook.44723: Flags [.], seq 476:1876, ack 415, win 6432, options [nop,nop,TS val 1631716072 ecr 47245975], length 1400
1335107160.143848 IP bilbo-netbook.44723 > upload.esams.wikimedia.org.www: Flags [.], ack 1876, win 9800, options [nop,nop,TS val 47246005 ecr 1631716072], length 0
1335107160.144067 IP localhost.8118 > localhost.41956: Flags [P.], seq 476:1876, ack 472, win 33768, options [nop,nop,TS val 47246005 ecr 47246003], length 1400
1335107160.144095 IP localhost.41956 > localhost.8118: Flags [.], ack 1876, win 36400, options [nop,nop,TS val 47246005 ecr 47246005], length 0
1335107160.150283 IP upload.esams.wikimedia.org.www > bilbo-netbook.44723: Flags [.], seq 1876:3276, ack 415, win 6432, options [nop,nop,TS val 1631716072 ecr 47245975], length 1400
1335107160.150404 IP bilbo-netbook.44723 > upload.esams.wikimedia.org.www: Flags [.], ack 3276, win 12600, options [nop,nop,TS val 47246007 ecr 1631716072], length 0
1335107160.150634 IP localhost.8118 > localhost.41956: Flags [P.], seq 1876:3276, ack 472, win 33768, options [nop,nop,TS val 47246007 ecr 47246005], length 1400
1335107160.150665 IP localhost.41956 > localhost.8118: Flags [.], ack 3276, win 39200, options [nop,nop,TS val 47246007 ecr 47246007], length 0
1335107160.157692 IP upload.esams.wikimedia.org.www > bilbo-netbook.44724: Flags [F.], seq 274, ack 508, win 6432, options [nop,nop,TS val 1408438166 ecr 47245975], length 0
1335107160.157824 IP bilbo-netbook.44724 > upload.esams.wikimedia.org.www: Flags [.], ack 275, win 6432, options [nop,nop,TS val 47246008 ecr 1408438166], length 0
1335107160.158626 IP upload.esams.wikimedia.org.www > bilbo-netbook.44728: Flags [S.], seq 17882093, ack 64575966, win 5792, options [mss 1412,sackOK,TS val 1631573082 ecr 47245986], length 0
1335107160.158764 IP bilbo-netbook.44728 > upload.esams.wikimedia.org.www: Flags [.], ack 1, win 5840, options [nop,nop,TS val 47246009 ecr 1631573082], length 0
1335107160.158976 IP bilbo-netbook.44728 > upload.esams.wikimedia.org.www: Flags [P.], seq 1:505, ack 1, win 5840, options [nop,nop,TS val 47246009 ecr 1631573082], length 504
1335107160.173945 IP localhost.41955 > localhost.8118: Flags [.], ack 275, win 32792, options [nop,nop,TS val 47246013 ecr 47246003], length 0
1335107160.181254 IP localhost.41955 > localhost.8118: Flags [F.], seq 565, ack 275, win 32792, options [nop,nop,TS val 47246014 ecr 47246003], length 0
1335107160.181295 IP localhost.8118 > localhost.41955: Flags [.], ack 566, win 33840, options [nop,nop,TS val 47246014 ecr 47246014], length 0
1335107160.181470 IP localhost.41963 > localhost.8118: Flags [S], seq 66007266, win 32792, options [mss 16396,sackOK,TS val 47246014 ecr 0], length 0
1335107160.181501 IP localhost.8118 > localhost.41963: Flags [S.], seq 68559333, ack 66007267, win 32768, options [mss 16396,sackOK,TS val 47246014 ecr 47246014], length 0
1335107160.181527 IP localhost.41963 > localhost.8118: Flags [.], ack 1, win 32792, options [nop,nop,TS val 47246014 ecr 47246014], length 0
1335107160.225334 IP upload.esams.wikimedia.org.www > bilbo-netbook.44726: Flags [.], ack 419, win 6432, options [nop,nop,TS val 1416428162 ecr 47245989], length 0
1335107160.231377 IP upload.esams.wikimedia.org.www > bilbo-netbook.44723: Flags [.], seq 3276:4676, ack 415, win 6432, options [nop,nop,TS val 1631716082 ecr 47246003], length 1400
1335107160.231504 IP bilbo-netbook.44723 > upload.esams.wikimedia.org.www: Flags [.], ack 4676, win 15400, options [nop,nop,TS val 47246027 ecr 1631716082], length 0
1335107160.231725 IP localhost.8118 > localhost.41956: Flags [P.], seq 3276:4676, ack 472, win 33768, options [nop,nop,TS val 47246027 ecr 47246007], length 1400
1335107160.231752 IP localhost.41956 > localhost.8118: Flags [.], ack 4676, win 42000, options [nop,nop,TS val 47246027 ecr 47246027], length 0
1335107160.266593 IP localhost.41963 > localhost.8118: Flags [P.], seq 1:500, ack 1, win 32792, options [nop,nop,TS val 47246036 ecr 47246014], length 499
1335107160.266653 IP localhost.8118 > localhost.41963: Flags [.], ack 500, win 33768, options [nop,nop,TS val 47246036 ecr 47246036], length 0
1335107160.267602 IP bilbo-netbook.51340 > router.domain: 9950+ A? upload.wikimedia.org. (38)
1335107160.268139 IP localhost.41963 > localhost.8118: Flags [F.], seq 500, ack 1, win 32792, options [nop,nop,TS val 47246036 ecr 47246036], length 0
1335107160.268410 IP router.domain > bilbo-netbook.51340: 9950 2/0/0 CNAME upload.esams.wikimedia.org., A 91.198.174.234 (94)
1335107160.268815 IP bilbo-netbook.44730 > upload.esams.wikimedia.org.www: Flags [S], seq 76007995, win 5840, options [mss 1460,sackOK,TS val 47246036 ecr 0], length 0
1335107160.270494 IP upload.esams.wikimedia.org.www > bilbo-netbook.44723: Flags [.], seq 4676:6076, ack 415, win 6432, options [nop,nop,TS val 1631716082 ecr 47246003], length 1400
1335107160.270611 IP bilbo-netbook.44723 > upload.esams.wikimedia.org.www: Flags [.], ack 6076, win 18200, options [nop,nop,TS val 47246037 ecr 1631716082], length 0
1335107160.270824 IP localhost.8118 > localhost.41956: Flags [P.], seq 4676:6076, ack 472, win 33768, options [nop,nop,TS val 47246037 ecr 47246027], length 1400
1335107160.270859 IP localhost.41956 > localhost.8118: Flags [.], ack 6076, win 44800, options [nop,nop,TS val 47246037 ecr 47246037], length 0
1335107160.271624 IP upload.esams.wikimedia.org.www > bilbo-netbook.44726: Flags [P.], seq 1:475, ack 419, win 6432, options [nop,nop,TS val 1416428162 ecr 47245989], length 474
1335107160.271737 IP bilbo-netbook.44726 > upload.esams.wikimedia.org.www: Flags [.], ack 475, win 6432, options [nop,nop,TS val 47246037 ecr 1416428162], length 0
1335107160.272085 IP localhost.8118 > localhost.41959: Flags [P.], seq 1:475, ack 476, win 33768, options [nop,nop,TS val 47246037 ecr 47245955], length 474
1335107160.272120 IP localhost.41959 > localhost.8118: Flags [.], ack 475, win 33768, options [nop,nop,TS val 47246037 ecr 47246037], length 0
1335107160.279035 IP upload.esams.wikimedia.org.www > bilbo-netbook.44726: Flags [P.], seq 475:981, ack 419, win 6432, options [nop,nop,TS val 1416428162 ecr 47245989], length 506
1335107160.279174 IP bilbo-netbook.44726 > upload.esams.wikimedia.org.www: Flags [.], ack 981, win 7504, options [nop,nop,TS val 47246038 ecr 1416428162], length 0
1335107160.279506 IP localhost.8118 > localhost.41959: Flags [P.], seq 475:981, ack 476, win 33768, options [nop,nop,TS val 47246039 ecr 47246037], length 506
1335107160.279548 IP localhost.41959 > localhost.8118: Flags [.], ack 981, win 34840, options [nop,nop,TS val 47246039 ecr 47246039], length 0
1335107160.279606 IP bilbo-netbook.44726 > upload.esams.wikimedia.org.www: Flags [F.], seq 419, ack 981, win 7504, options [nop,nop,TS val 47246039 ecr 1416428162], length 0
1335107160.279687 IP localhost.8118 > localhost.41959: Flags [F.], seq 981, ack 476, win 33768, options [nop,nop,TS val 47246039 ecr 47246039], length 0
1335107160.283121 IP localhost.41959 > localhost.8118: Flags [F.], seq 476, ack 982, win 34840, options [nop,nop,TS val 47246039 ecr 47246039], length 0
1335107160.283180 IP localhost.8118 > localhost.41959: Flags [.], ack 477, win 33768, options [nop,nop,TS val 47246039 ecr 47246039], length 0
1335107160.283418 IP localhost.41965 > localhost.8118: Flags [S], seq 75303753, win 32792, options [mss 16396,sackOK,TS val 47246040 ecr 0], length 0
1335107160.283461 IP localhost.8118 > localhost.41965: Flags [S.], seq 82018873, ack 75303754, win 32768, options [mss 16396,sackOK,TS val 47246040 ecr 47246040], length 0
1335107160.283491 IP localhost.41965 > localhost.8118: Flags [.], ack 1, win 32792, options [nop,nop,TS val 47246040 ecr 47246040], length 0
1335107160.284772 IP localhost.41965 > localhost.8118: Flags [P.], seq 1:506, ack 1, win 32792, options [nop,nop,TS val 47246040 ecr 47246040], length 505
1335107160.284833 IP localhost.8118 > localhost.41965: Flags [.], ack 506, win 33768, options [nop,nop,TS val 47246040 ecr 47246040], length 0
1335107160.285647 IP bilbo-netbook.34711 > router.domain: 14613+ A? upload.wikimedia.org. (38)
1335107160.286490 IP router.domain > bilbo-netbook.34711: 14613 2/0/0 CNAME upload.esams.wikimedia.org., A 91.198.174.234 (94)
1335107160.287010 IP bilbo-netbook.44732 > upload.esams.wikimedia.org.www: Flags [S], seq 75303918, win 5840, options [mss 1460,sackOK,TS val 47246041 ecr 0], length 0
1335107160.288742 IP upload.esams.wikimedia.org.www > bilbo-netbook.44726: Flags [F.], seq 981, ack 419, win 6432, options [nop,nop,TS val 1416428162 ecr 47245989], length 0
1335107160.288880 IP bilbo-netbook.44726 > upload.esams.wikimedia.org.www: Flags [.], ack 982, win 7504, options [nop,nop,TS val 47246041 ecr 1416428162], length 0
1335107160.290230 IP upload.esams.wikimedia.org.www > bilbo-netbook.44724: Flags [.], ack 509, win 6432, options [nop,nop,TS val 1408438176 ecr 47246003], length 0
1335107160.294886 IP upload.esams.wikimedia.org.www > bilbo-netbook.44723: Flags [.], seq 6076:7476, ack 415, win 6432, options [nop,nop,TS val 1631716083 ecr 47246005], length 1400
1335107160.295025 IP bilbo-netbook.44723 > upload.esams.wikimedia.org.www: Flags [.], ack 7476, win 21000, options [nop,nop,TS val 47246042 ecr 1631716083], length 0
1335107160.295250 IP localhost.8118 > localhost.41956: Flags [P.], seq 6076:7476, ack 472, win 33768, options [nop,nop,TS val 47246042 ecr 47246037], length 1400
1335107160.295279 IP localhost.41956 > localhost.8118: Flags [.], ack 7476, win 47600, options [nop,nop,TS val 47246042 ecr 47246042], length 0
1335107160.303614 IP upload.esams.wikimedia.org.www > bilbo-netbook.44723: Flags [.], seq 7476:8876, ack 415, win 6432, options [nop,nop,TS val 1631716083 ecr 47246005], length 1400
1335107160.303743 IP bilbo-netbook.44723 > upload.esams.wikimedia.org.www: Flags [.], ack 8876, win 23800, options [nop,nop,TS val 47246045 ecr 1631716083], length 0
1335107160.303961 IP localhost.8118 > localhost.41956: Flags [P.], seq 7476:8876, ack 472, win 33768, options [nop,nop,TS val 47246045 ecr 47246042], length 1400
1335107160.303992 IP localhost.41956 > localhost.8118: Flags [.], ack 8876, win 50400, options [nop,nop,TS val 47246045 ecr 47246045], length 0
1335107160.305928 IP localhost.8118 > localhost.41963: Flags [.], ack 501, win 33768, options [nop,nop,TS val 47246046 ecr 47246036], length 0
1335107160.372950 IP upload.esams.wikimedia.org.www > bilbo-netbook.44723: Flags [.], seq 8876:10276, ack 415, win 6432, options [nop,nop,TS val 1631716084 ecr 47246007], length 1400
1335107160.373083 IP bilbo-netbook.44723 > upload.esams.wikimedia.org.www: Flags [.], ack 10276, win 26600, options [nop,nop,TS val 47246062 ecr 1631716084], length 0
1335107160.373297 IP localhost.8118 > localhost.41956: Flags [P.], seq 8876:10276, ack 472, win 33768, options [nop,nop,TS val 47246062 ecr 47246045], length 1400
1335107160.373322 IP localhost.41956 > localhost.8118: Flags [.], ack 10276, win 53200, options [nop,nop,TS val 47246062 ecr 47246062], length 0
1335107160.407528 IP upload.esams.wikimedia.org.www > bilbo-netbook.44723: Flags [P.], seq 10276:11676, ack 415, win 6432, options [nop,nop,TS val 1631716084 ecr 47246007], length 1400
1335107160.407663 IP bilbo-netbook.44723 > upload.esams.wikimedia.org.www: Flags [.], ack 11676, win 29400, options [nop,nop,TS val 47246071 ecr 1631716084], length 0
1335107160.407862 IP localhost.8118 > localhost.41956: Flags [P.], seq 10276:11676, ack 472, win 33768, options [nop,nop,TS val 47246071 ecr 47246062], length 1400
1335107160.407892 IP localhost.41956 > localhost.8118: Flags [.], ack 11676, win 56000, options [nop,nop,TS val 47246071 ecr 47246071], length 0
1335107160.446089 IP upload.esams.wikimedia.org.www > bilbo-netbook.44728: Flags [.], ack 505, win 6432, options [nop,nop,TS val 1631573095 ecr 47246009], length 0
1335107160.448171 IP upload.esams.wikimedia.org.www > bilbo-netbook.44728: Flags [P.], seq 1:401, ack 505, win 6432, options [nop,nop,TS val 1631573095 ecr 47246009], length 400
1335107160.448289 IP bilbo-netbook.44728 > upload.esams.wikimedia.org.www: Flags [.], ack 401, win 6432, options [nop,nop,TS val 47246081 ecr 1631573095], length 0
1335107160.448740 IP localhost.8118 > localhost.41961: Flags [P.], seq 1:401, ack 562, win 33660, options [nop,nop,TS val 47246081 ecr 47245985], length 400
1335107160.448797 IP localhost.41961 > localhost.8118: Flags [.], ack 401, win 33768, options [nop,nop,TS val 47246081 ecr 47246081], length 0
1335107160.449029 IP bilbo-netbook.44728 > upload.esams.wikimedia.org.www: Flags [F.], seq 505, ack 401, win 6432, options [nop,nop,TS val 47246081 ecr 1631573095], length 0
1335107160.449209 IP localhost.8118 > localhost.41961: Flags [F.], seq 401, ack 562, win 33660, options [nop,nop,TS val 47246081 ecr 47246081], length 0
1335107160.450047 IP upload.esams.wikimedia.org.www > bilbo-netbook.44728: Flags [F.], seq 401, ack 505, win 6432, options [nop,nop,TS val 1631573095 ecr 47246009], length 0
1335107160.450195 IP bilbo-netbook.44728 > upload.esams.wikimedia.org.www: Flags [.], ack 402, win 6432, options [nop,nop,TS val 47246082 ecr 1631573095], length 0
1335107160.474267 IP upload.esams.wikimedia.org.www > bilbo-netbook.44723: Flags [.], seq 11676:13076, ack 415, win 6432, options [nop,nop,TS val 1631716087 ecr 47246027], length 1400
1335107160.474420 IP bilbo-netbook.44723 > upload.esams.wikimedia.org.www: Flags [.], ack 13076, win 32200, options [nop,nop,TS val 47246088 ecr 1631716087], length 0
1335107160.474647 IP localhost.8118 > localhost.41956: Flags [P.], seq 11676:13076, ack 472, win 33768, options [nop,nop,TS val 47246088 ecr 47246071], length 1400
1335107160.474684 IP localhost.41956 > localhost.8118: Flags [.], ack 13076, win 58800, options [nop,nop,TS val 47246088 ecr 47246088], length 0
1335107160.480843 IP upload.esams.wikimedia.org.www > bilbo-netbook.44723: Flags [.], seq 13076:14476, ack 415, win 6432, options [nop,nop,TS val 1631716087 ecr 47246027], length 1400
1335107160.480996 IP bilbo-netbook.44723 > upload.esams.wikimedia.org.www: Flags [.], ack 14476, win 35000, options [nop,nop,TS val 47246089 ecr 1631716087], length 0
1335107160.481205 IP localhost.8118 > localhost.41956: Flags [P.], seq 13076:14476, ack 472, win 33768, options [nop,nop,TS val 47246089 ecr 47246088], length 1400
